Date,Versus,Ground,How Dismissed,Runs,S/R,catches,aggregate,catches_wk,stumping_wk,agg_wk,age,who_dismissed,played_city,played_country
2007-06-23,Ireland,Civil Service Cricket Club,did not bat,,0.0,1,1,0.0,0.0,0.0,20,0,Belfast,Ireland
2007-06-26,South Africa,Civil Service Cricket Club,b J H Kallis,8.0,88.89,1,2,0.0,0.0,0.0,20,J H Kallis,Belfast,Ireland
2007-05-10,Australia,Rajiv Gandhi International Stadium,c B Lee b J R Hopes,1.0,25.0,0,2,0.0,0.0,0.0,20,J R Hopes,Hyderabad,India
2019-02-03,Australia,Rajiv Gandhi International Stadium,0,37.0,56.06,0,73,0.0,0.0,0.0,31,0,Hyderabad,India
2007-11-18,Pakistan,Sawai Mansingh Stadium,c Yasir Hameed b Shoaib Malik,52.0,85.25,1,3,0.0,0.0,0.0,20,Shoaib Malik,Jaipur,India
2013-10-16,Australia,Sawai Mansingh Stadium,not out,141.0,114.63,0,35,0.0,0.0,0.0,26,0,Jaipur,India
2008-03-02,Australia,Brisbane Cricket Ground,c †A C Gilchrist b B Lee,29.0,67.44,0,3,0.0,0.0,0.0,20,B Lee,Brisbane,Australia
2008-04-02,Sri Lanka,Brisbane Cricket Ground,c †K C Sangakkara b M Muralitharan,0.0,0.0,0,3,0.0,0.0,0.0,20,M Muralitharan,Brisbane,Australia
2008-04-03,Australia,Brisbane Cricket Ground,c A Symonds b M J Clarke,2.0,40.0,0,8,0.0,0.0,0.0,20,M J Clarke,Brisbane,Australia
2012-02-19,Australia,Brisbane Cricket Ground,c †M S Wade b B Lee,0.0,0.0,1,29,0.0,0.0,0.0,24,B Lee,Brisbane,Australia
2016-01-15,Australia,Brisbane Cricket Ground,run out,124.0,97.64,0,49,0.0,0.0,0.0,28,0,Brisbane,Australia
2008-10-02,Australia,Melbourne Cricket Ground,not out,39.0,63.93,1,4,0.0,0.0,0.0,20,0,Melbourne,Australia
2012-05-02,Australia,Melbourne Cricket Ground,c †M S Wade b C J McKay,21.0,100.0,0,26,0.0,0.0,0.0,24,C J McKay,Melbourne,Australia
2015-01-18,Australia,Melbourne Cricket Ground,c G J Maxwell b M A Starc,138.0,99.28,0,43,0.0,0.0,0.0,27,M A Starc,Melbourne,Australia
2015-02-22,South Africa,Melbourne Cricket Ground,run out,0.0,0.0,0,43,0.0,0.0,0.0,27,0,Melbourne,Australia
2015-03-19,Bangladesh,Melbourne Cricket Ground,b Taskin Ahmed,137.0,108.73,0,44,0.0,0.0,0.0,27,Taskin Ahmed,Melbourne,Australia
2016-01-17,Australia,Melbourne Cricket Ground,c †M S Wade b K W Richardson,6.0,54.55,0,49,0.0,0.0,0.0,28,K W Richardson,Melbourne,Australia
2019-01-18,Australia,Melbourne Cricket Ground,c S E Marsh b P M Siddle,9.0,52.94,1,71,0.0,0.0,0.0,31,P M Siddle,Melbourne,Australia
2008-12-02,Sri Lanka,Manuka Oval,not out,70.0,109.38,0,4,0.0,0.0,0.0,20,0,Canberra,Australia
2016-01-20,Australia,Manuka Oval,c †M S Wade b K W Richardson,41.0,164.0,1,50,0.0,0.0,0.0,28,K W Richardson,Canberra,Australia
2008-02-17,Australia,Adelaide Oval,c †A C Gilchrist b J R Hopes,1.0,33.33,1,5,0.0,0.0,0.0,20,J R Hopes,Adelaide,Australia
2008-02-19,Sri Lanka,Adelaide Oval,c L P C Silva b M Muralitharan,24.0,66.67,0,5,0.0,0.0,0.0,20,M Muralitharan,Adelaide,Australia
2012-12-02,Australia,Adelaide Oval,c M A Starc b R J Harris,33.0,80.49,0,28,0.0,0.0,0.0,24,R J Harris,Adelaide,Australia
2012-02-14,Sri Lanka,Adelaide Oval,run out,15.0,55.56,0,28,0.0,0.0,0.0,24,0,Adelaide,Australia
2015-02-15,Pakistan,Adelaide Oval,0,15.0,75.0,0,43,0.0,0.0,0.0,27,Sohail Khan,Adelaide,Australia
2019-01-15,Australia,Adelaide Oval,c P S P Handscomb b M P Stoinis,43.0,82.69,0,70,0.0,0.0,0.0,31,b M P Stoinis,Adelaide,Australia
2008-02-26,Sri Lanka,Bellerive Oval,not out,3.0,42.86,1,7,0.0,0.0,0.0,20,0,Hobart,Australia
2008-06-25,Hong Kong,National Stadium,run out,11.0,37.93,0,10,0.0,0.0,0.0,21,0,Karachi,Pakistan
2008-06-26,Pakistan,National Stadium,not out,0.0,0.0,0,10,0.0,0.0,0.0,21,0,Karachi,Pakistan
2008-06-28,Bangladesh,National Stadium,c Farhad Reza b Shahadat Hossain,22.0,95.65,0,10,0.0,0.0,0.0,21,Shahadat Hossain,Karachi,Pakistan
2008-02-07,Pakistan,National Stadium,c Abdur Rauf b Iftikhar Anjum,58.0,81.69,0,10,0.0,0.0,0.0,21,Iftikhar Anjum,Karachi,Pakistan
2008-03-07,Sri Lanka,National Stadium,not out,22.0,78.57,0,10,0.0,0.0,0.0,21,0,Karachi,Pakistan
2008-06-07,Sri Lanka,National Stadium,lbw b B A W Mendis,3.0,37.5,1,11,0.0,0.0,0.0,21,B A W Mendis,Karachi,Pakistan
2008-08-18,Sri Lanka,Rangiri Dambulla International Stadium,c D P M D Jayawardene b T Thushara,19.0,61.29,0,11,0.0,0.0,0.0,21,T Thushara,Dambulla,Sri Lanka
2008-08-20,Sri Lanka,Rangiri Dambulla International Stadium,lbw b T Thushara,0.0,0.0,0,11,0.0,0.0,0.0,21,T Thushara,Dambulla,Sri Lanka
2009-01-28,Sri Lanka,Rangiri Dambulla International Stadium,not out,25.0,83.33,1,12,0.0,0.0,0.0,21,0,Dambulla,Sri Lanka
2010-06-16,Bangladesh,Rangiri Dambulla International Stadium,lbw b Shakib Al Hasan,0.0,0.0,0,18,0.0,0.0,0.0,23,Shakib Al Hasan,Dambulla,Sri Lanka
2010-06-19,Pakistan,Rangiri Dambulla International Stadium,lbw b Shahid Afridi,22.0,91.67,0,18,0.0,0.0,0.0,23,Shahid Afridi,Dambulla,Sri Lanka
2010-06-22,Sri Lanka,Rangiri Dambulla International Stadium,run out,69.0,94.52,0,18,0.0,0.0,0.0,23,0,Dambulla,Sri Lanka
2010-06-24,Sri Lanka,Rangiri Dambulla International Stadium,c M F Maharoof b K M D N Kulasekara,41.0,78.85,0,18,0.0,0.0,0.0,23,K M D N Kulasekara,Dambulla,Sri Lanka
2010-10-08,New Zealand,Rangiri Dambulla International Stadium,c L R P L Taylor b D R Tuffey,4.0,36.36,0,18,0.0,0.0,0.0,23,D R Tuffey,Dambulla,Sri Lanka
2010-08-16,Sri Lanka,Rangiri Dambulla International Stadium,lbw b A D Mathews,0.0,0.0,1,19,0.0,0.0,0.0,23,A D Mathews,Dambulla,Sri Lanka
2010-08-21,Sri Lanka,Rangiri Dambulla International Stadium,lbw b A D Mathews,11.0,52.38,0,19,0.0,0.0,0.0,23,A D Mathews,Dambulla,Sri Lanka
2010-08-28,Sri Lanka,Rangiri Dambulla International Stadium,st K C Sangakkara b S Randiv,5.0,55.56,2,21,0.0,0.0,0.0,23,S Randiv,Dambulla,Sri Lanka
2017-08-20,Sri Lanka,Rangiri Dambulla International Stadium,run out,4.0,30.77,0,54,0.0,0.0,0.0,30,0,Dambulla,Sri Lanka
2008-08-24,Sri Lanka,R Premadasa Stadium,c C K Kapugedera b T Thushara,32.0,100.0,0,11,0.0,0.0,0.0,21,T Thushara,Colombo,Sri Lanka
2008-08-27,Sri Lanka,R Premadasa Stadium,c B S M Warnapura b B A W Mendis,18.0,78.26,0,11,0.0,0.0,0.0,21,B A W Mendis,Colombo,Sri Lanka
2008-08-29,Sri Lanka,R Premadasa Stadium,lbw b K M D N Kulasekara,3.0,60.0,0,11,0.0,0.0,0.0,21,K M D N Kulasekara,Colombo,Sri Lanka
2009-05-02,Sri Lanka,R Premadasa Stadium,not out,4.0,66.67,2,14,0.0,0.0,0.0,21,0,Colombo,Sri Lanka
2009-08-02,Sri Lanka,R Premadasa Stadium,c K M D N Kulasekara b M F Maharoof,15.0,68.18,1,15,0.0,0.0,0.0,21,M F Maharoof,Colombo,Sri Lanka
2012-07-28,Sri Lanka,R Premadasa Stadium,lbw b S L Malinga,0.0,0.0,0,31,0.0,0.0,0.0,25,S L Malinga,Colombo,Sri Lanka
2012-07-31,Sri Lanka,R Premadasa Stadium,lbw b N Pradeep,4.0,28.57,0,31,0.0,0.0,0.0,25,N Pradeep,Colombo,Sri Lanka
2017-08-31,Sri Lanka,R Premadasa Stadium,c †N Dickwella b A D Mathews,104.0,118.18,0,56,0.0,0.0,0.0,30,A D Mathews,Colombo,Sri Lanka
2017-03-09,Sri Lanka,R Premadasa Stadium,c P M Pushpakumara b M V T Fernando,16.0,80.0,0,56,0.0,0.0,0.0,30,M V T Fernando,Colombo,Sri Lanka
2008-11-14,England,Madhavrao Scindia Cricket Ground,not out,11.0,137.5,0,11,0.0,0.0,0.0,21,0,Rajkot,India
2008-11-17,England,Holkar Cricket Stadium,c O A Shah b S C J Broad,3.0,23.08,0,11,0.0,0.0,0.0,21,S C J Broad,Indore,India
2011-08-12,West Indies,Holkar Cricket Stadium,b K A J Roach,27.0,168.75,1,26,0.0,0.0,0.0,24,K A J Roach,Indore,India
2015-10-14,South Africa,Holkar Cricket Stadium,b K Rabada,3.0,30.0,0,49,0.0,0.0,0.0,28,K Rabada,Indore,India
2017-09-24,Australia,Holkar Cricket Stadium,0,71.0,114.52,0,56,0.0,0.0,0.0,30,0,Indore,India
2008-11-20,England,Green Park,c †M J Prior b G P Swann,28.0,68.29,0,11,0.0,0.0,0.0,21,G P Swann,Kanpur,India
2013-11-27,West Indies,Green Park,c D J J Bravo b R Rampaul,4.0,28.57,0,36,0.0,0.0,0.0,26,R Rampaul,Kanpur,India
2015-11-10,South Africa,Green Park,c & b Imran Tahir,150.0,112.78,0,49,0.0,0.0,0.0,28,Imran Tahir,Kanpur,India
2017-10-29,New Zealand,Green Park,c T G Southee b M J Santner,147.0,106.52,0,56,0.0,0.0,0.0,30,M J Santner,Kanpur,India
2008-11-26,England,Barabati Stadium,not out,8.0,80.0,0,11,0.0,0.0,0.0,21,0,Cuttack,India
2011-11-29,West Indies,Barabati Stadium,b A Martin,72.0,72.73,0,25,0.0,0.0,0.0,24,A Martin,Cuttack,India
2009-11-03,New Zealand,Seddon Park,did not bat,,0.0,1,16,0.0,0.0,0.0,21,0,Hamilton,New Zealand
2014-01-22,New Zealand,Seddon Park,c †L Ronchi b T G Southee,20.0,58.82,0,38,0.0,0.0,0.0,26,T G Southee,Hamilton,New Zealand
2014-01-28,New Zealand,Seddon Park,c †L Ronchi b K S Williamson,79.0,84.04,0,38,0.0,0.0,0.0,26,K S Williamson,Hamilton,New Zealand
2015-10-03,Ireland,Seddon Park,b S R Thompson,64.0,96.97,0,43,0.0,0.0,0.0,27,S R Thompson,Hamilton,New Zealand
2019-01-31,New Zealand,Seddon Park,c & b T A Boult,7.0,30.43,0,73,0.0,0.0,0.0,31,T A Boult,Hamilton,New Zealand
2009-03-14,New Zealand,Eden Park,not out,43.0,58.11,0,16,0.0,0.0,0.0,21,0,Auckland,New Zealand
2014-01-25,New Zealand,Eden Park,c H K Bennett b C J Anderson,39.0,102.63,0,38,0.0,0.0,0.0,26,C J Anderson,Auckland,New Zealand
2015-03-14,Zimbabwe,Eden Park,c Sikandar Raza b T Panyangara,16.0,76.19,1,44,0.0,0.0,0.0,27,T Panyangara,Auckland,New Zealand
2009-06-26,West Indies,Sabina Park,c D J J Bravo b L S Baker,4.0,33.33,2,18,0.0,0.0,0.0,22,L S Baker,"Kingston, Jamaica",West Indies
2009-06-28,West Indies,Sabina Park,c R S Morton b R Rampaul,0.0,0.0,0,18,0.0,0.0,0.0,22,R Rampaul,"Kingston, Jamaica",West Indies
2011-06-16,West Indies,Sabina Park,b A Martin,57.0,79.17,0,25,0.0,0.0,0.0,24,A Martin,"Kingston, Jamaica",West Indies
2013-06-30,West Indies,Sabina Park,c J Charles b D J G Sammy,60.0,67.42,0,33,0.0,0.0,0.0,26,D J G Sammy,"Kingston, Jamaica",West Indies
2013-02-07,Sri Lanka,Sabina Park,c A D Mathews b K M D N Kulasekara,5.0,38.46,0,33,0.0,0.0,0.0,26,K M D N Kulasekara,"Kingston, Jamaica",West Indies
2009-03-07,West Indies,Darren Sammy National Cricket Stadium,c D E Bernard b D J J Bravo,11.0,122.22,0,18,0.0,0.0,0.0,22,D J J Bravo,"Gros Islet, St Lucia",West Indies
2009-05-07,West Indies,Darren Sammy National Cricket Stadium,did not bat,,0.0,0,18,0.0,0.0,0.0,22,0,"Gros Islet, St Lucia",West Indies
2010-02-27,South Africa,Sardar Patel Stadium,c L L Tsotsobe b J Botha,48.0,78.69,0,18,0.0,0.0,0.0,22,J Botha,Ahmedabad,India
2011-05-12,West Indies,Sardar Patel Stadium,run out,95.0,95.0,0,25,0.0,0.0,0.0,24,0,Ahmedabad,India
2010-05-28,Zimbabwe,Queens Sports Club,c †B R M Taylor b C B Mpofu,114.0,95.8,0,18,0.0,0.0,0.0,23,C B Mpofu,Bulawayo,Zimbabwe
2010-05-30,Sri Lanka,Queens Sports Club,not out,101.0,101.0,0,18,0.0,0.0,0.0,23,0,Bulawayo,Zimbabwe
2013-01-08,Zimbabwe,Queens Sports Club,not out,64.0,71.11,1,34,0.0,0.0,0.0,26,0,Bulawayo,Zimbabwe
2010-03-06,Zimbabwe,Harare Sports Club,run out,13.0,52.0,0,18,0.0,0.0,0.0,23,0,Harare,Zimbabwe
2010-05-06,Sri Lanka,Harare Sports Club,b S Randiv,32.0,80.0,0,18,0.0,0.0,0.0,23,S Randiv,Harare,Zimbabwe
2013-07-24,Zimbabwe,Harare Sports Club,c †B R M Taylor b E Chigumbura,20.0,50.0,0,33,0.0,0.0,0.0,26,E Chigumbura,Harare,Zimbabwe
2013-07-26,Zimbabwe,Harare Sports Club,c V Sibanda b B V Vitori,1.0,14.29,0,33,0.0,0.0,0.0,26,B V Vitori,Harare,Zimbabwe
2013-07-28,Zimbabwe,Harare Sports Club,c †B R M Taylor b M T Chinouya,14.0,66.67,0,33,0.0,0.0,0.0,26,M T Chinouya,Harare,Zimbabwe
2010-07-12,New Zealand,M Chinnaswamy Stadium,c D L Vettori b T G Southee,44.0,91.67,1,22,0.0,0.0,0.0,23,T G Southee,"Bengaluru, Bangalore",India
2013-02-11,Australia,M Chinnaswamy Stadium,c sub b C J McKay,209.0,132.28,0,36,0.0,0.0,0.0,26,b C J McKay,"Bengaluru, Bangalore",India
2017-09-28,Australia,M Chinnaswamy Stadium,run out,65.0,118.18,0,56,0.0,0.0,0.0,30,0,"Bengaluru, Bangalore",India
2010-10-12,New Zealand,MA Chidambaram Stadium,did not bat,,0.0,1,23,0.0,0.0,0.0,23,0,Chennai,India
2011-11-12,West Indies,MA Chidambaram Stadium,b S P Narine,21.0,80.77,0,26,0.0,0.0,0.0,24,S P Narine,Chennai,India
2012-12-30,Pakistan,MA Chidambaram Stadium,c Mohammad Hafeez b Junaid Khan,4.0,28.57,1,32,0.0,0.0,0.0,25,Junaid Khan,Chennai,India
2015-10-22,South Africa,MA Chidambaram Stadium,c F du Plessis b C H Morris,21.0,110.53,0,49,0.0,0.0,0.0,28,C H Morris,Chennai,India
2017-09-17,Australia,MA Chidambaram Stadium,0,28.0,63.64,0,56,0.0,0.0,0.0,30,M P Stoinis,Chennai,India
2011-12-01,South Africa,Kingsmead,c †A B de Villiers b M Morkel,11.0,40.74,1,24,0.0,0.0,0.0,23,M Morkel,Durban,South Africa
2013-08-12,South Africa,Kingsmead,c H M Amla b L L Tsotsobe,19.0,73.08,1,37,0.0,0.0,0.0,26,L L Tsotsobe,Durban,South Africa
2018-01-02,South Africa,Kingsmead,c †Q de Kock b M Morkel,20.0,66.67,0,58,0.0,0.0,0.0,30,M Morkel,Durban,South Africa
2011-01-15,South Africa,New Wanderers Stadium,lbw b M Morkel,9.0,64.29,0,24,0.0,0.0,0.0,23,M Morkel,Johannesburg,South Africa
2013-05-12,South Africa,New Wanderers Stadium,run out,18.0,41.86,0,36,0.0,0.0,0.0,26,0,Johannesburg,South Africa
2018-10-02,South Africa,New Wanderers Stadium,c & b K Rabada,5.0,38.46,1,59,0.0,0.0,0.0,30,K Rabada,Johannesburg,South Africa
2011-01-18,South Africa,Newlands,b M Morkel,23.0,51.11,0,24,0.0,0.0,0.0,23,M Morkel,Cape Town,South Africa
2018-07-02,South Africa,Newlands,c †H Klaasen b K Rabada,0.0,0.0,0,58,0.0,0.0,0.0,30,K Rabada,Cape Town,South Africa
2011-06-06,West Indies,Queen's Park Oval,not out,68.0,90.67,1,25,0.0,0.0,0.0,24,0,0,West Indies
2011-08-06,West Indies,Queen's Park Oval,not out,7.0,50.0,0,25,0.0,0.0,0.0,24,0,0,West Indies
2013-05-07,West Indies,Queen's Park Oval,c †D Ramdin b T L Best,46.0,58.97,0,33,0.0,0.0,0.0,26,T L Best,0,West Indies
2013-09-07,Sri Lanka,Queen's Park Oval,not out,48.0,57.83,0,33,0.0,0.0,0.0,26,0,0,West Indies
2013-11-07,Sri Lanka,Queen's Park Oval,b H M R K B Herath,58.0,65.17,0,33,0.0,0.0,0.0,26,H M R K B Herath,0,West Indies
2011-03-09,England,Riverside Ground,retired hurt,0.0,0.0,0,25,0.0,0.0,0.0,24,0,0,England
2011-02-12,West Indies,Dr YS Rajasekhara Reddy Cricket Stadium,not out,90.0,91.84,0,25,0.0,0.0,0.0,24,0,Visakhapatnam,India
2013-11-24,West Indies,Dr YS Rajasekhara Reddy Cricket Stadium,c D J G Sammy b R Rampaul,12.0,63.16,0,36,0.0,0.0,0.0,26,R Rampaul,Visakhapatnam,India
2016-10-29,New Zealand,Dr YS Rajasekhara Reddy Cricket Stadium,c J D S Neesham b T A Boult,70.0,107.69,0,54,0.0,0.0,0.0,29,T A Boult,Visakhapatnam,India
2017-12-17,Sri Lanka,Dr YS Rajasekhara Reddy Cricket Stadium,b A Dananjaya,7.0,50.0,1,58,0.0,0.0,0.0,30,A Dananjaya,Visakhapatnam,India
2018-10-24,West Indies,Dr YS Rajasekhara Reddy Cricket Stadium,c S O Hetmeyer b K A J Roach,4.0,50.0,1,64,0.0,0.0,0.0,31,K A J Roach,Visakhapatnam,India
2012-07-21,Sri Lanka,Mahinda Rajapaksha International Cricket Stadium,b A D Mathews,5.0,62.5,0,31,0.0,0.0,0.0,25,A D Mathews,Hambantota,Sri Lanka
2012-07-24,Sri Lanka,Mahinda Rajapaksha International Cricket Stadium,b A D Mathews,0.0,0.0,0,31,0.0,0.0,0.0,25,A D Mathews,Hambantota,Sri Lanka
2012-04-08,Sri Lanka,Pallekele International Cricket Stadium,b N Pradeep,4.0,44.44,0,31,0.0,0.0,0.0,25,N Pradeep,"Pallekele, Kandy",Sri Lanka
2017-08-24,Sri Lanka,Pallekele International Cricket Stadium,lbw b A Dananjaya,54.0,120.0,1,55,0.0,0.0,0.0,30,A Dananjaya,"Pallekele, Kandy",Sri Lanka
2017-08-27,Sri Lanka,Pallekele International Cricket Stadium,not out,124.0,85.52,1,56,0.0,0.0,0.0,30,0,"Pallekele, Kandy",Sri Lanka
2013-01-23,England,Punjab Cricket Association IS Bindra Stadium,lbw b S T Finn,83.0,89.25,0,32,0.0,0.0,0.0,25,S T Finn,"Mohali, Chandigarh",India
2013-10-19,Australia,Punjab Cricket Association IS Bindra Stadium,c A J Finch b S R Watson,11.0,50.0,0,35,0.0,0.0,0.0,26,S R Watson,"Mohali, Chandigarh",India
2016-10-23,New Zealand,Punjab Cricket Association IS Bindra Stadium,lbw b T G Southee,13.0,61.9,0,53,0.0,0.0,0.0,29,T G Southee,"Mohali, Chandigarh",India
2017-12-13,Sri Lanka,Punjab Cricket Association IS Bindra Stadium,not out,208.0,135.95,1,57,0.0,0.0,0.0,30,0,"Mohali, Chandigarh",India
2019-10-03,Australia,Punjab Cricket Association IS Bindra Stadium,c P S P Handscomb b J A Richardson,95.0,103.26,0,73,0.0,0.0,0.0,31,b J A Richardson,"Mohali, Chandigarh",India
2013-01-27,England,Himachal Pradesh Cricket Association Stadium,c J C Tredwell b T T Bresnan,4.0,44.44,0,32,0.0,0.0,0.0,25,T T Bresnan,Dharamsala,India
2016-10-16,New Zealand,Himachal Pradesh Cricket Association Stadium,lbw b D A J Bracewell,14.0,53.85,1,52,0.0,0.0,0.0,29,D A J Bracewell,Dharamsala,India
2017-10-12,Sri Lanka,Himachal Pradesh Cricket Association Stadium,c †N Dickwella b R A S Lakmal,2.0,15.38,0,56,0.0,0.0,0.0,30,R A S Lakmal,Dharamsala,India
2013-11-06,West Indies,Kennington Oval,c †J Charles b S P Narine,52.0,92.86,0,32,0.0,0.0,0.0,26,S P Narine,London,England
2017-08-06,Sri Lanka,Kennington Oval,c N L T C Perera b S L Malinga,78.0,98.73,0,54,0.0,0.0,0.0,30,S L Malinga,London,England
2017-11-06,South Africa,Kennington Oval,c †Q de Kock b M Morkel,12.0,60.0,0,54,0.0,0.0,0.0,30,M Morkel,London,England
2017-06-18,Pakistan,Kennington Oval,lbw b Mohammad Amir,0.0,0.0,0,54,0.0,0.0,0.0,30,Mohammad Amir,London,England
2013-06-15,Pakistan,Edgbaston,0,18.0,56.25,1,33,0.0,0.0,0.0,26,Saeed Ajmal,Birmingham,England
2013-06-23,England,Edgbaston,b S C J Broad,9.0,64.29,0,33,0.0,0.0,0.0,26,S C J Broad,Birmingham,England
2017-04-06,Pakistan,Edgbaston,run out,91.0,76.47,0,54,0.0,0.0,0.0,30,0,Birmingham,England
2017-06-15,Bangladesh,Edgbaston,not out,123.0,95.35,0,54,0.0,0.0,0.0,30,0,Birmingham,England
2013-10-13,Australia,Maharashtra Cricket Association Stadium,c P J Hughes b S R Watson,42.0,89.36,1,35,0.0,0.0,0.0,26,S R Watson,Pune,India
2017-10-25,New Zealand,Maharashtra Cricket Association Stadium,c C Munro b T G Southee,7.0,36.84,0,56,0.0,0.0,0.0,30,T G Southee,Pune,India
2018-10-27,West Indies,Maharashtra Cricket Association Stadium,b J O Holder,8.0,88.89,2,66,0.0,0.0,0.0,31,J O Holder,Pune,India
2013-10-23,Australia,JSCA International Stadium Complex,not out,9.0,69.23,1,36,0.0,0.0,0.0,26,0,Ranchi,India
2014-11-16,Sri Lanka,JSCA International Stadium Complex,b A D Mathews,9.0,75.0,1,43,0.0,0.0,0.0,27,A D Mathews,Ranchi,India
2016-10-26,New Zealand,JSCA International Stadium Complex,c †B J Watling b T G Southee,11.0,57.89,1,54,0.0,0.0,0.0,29,T G Southee,Ranchi,India
2019-08-03,Australia,JSCA International Stadium Complex,lbw b P J Cummins,14.0,100.0,0,73,0.0,0.0,0.0,31,P J Cummins,Ranchi,India
2013-11-21,West Indies,Nehru Stadium (Kochi),c L M P Simmons b R Rampaul,72.0,88.89,0,36,0.0,0.0,0.0,26,R Rampaul,Kochi,India
2014-01-19,New Zealand,McLean Park,c T G Southee b M J McClenaghan,3.0,13.04,0,38,0.0,0.0,0.0,26,M J McClenaghan,Napier,New Zealand
2019-01-23,New Zealand,McLean Park,c M J Guptill b D A J Bracewell,11.0,45.83,1,72,0.0,0.0,0.0,31,D A J Bracewell,Napier,New Zealand
2014-02-26,Bangladesh,Khan Shaheb Osman Ali Stadium,b Ziaur Rahman,21.0,72.41,1,40,0.0,0.0,0.0,26,Ziaur Rahman,Fatullah,Bangladesh
2014-02-28,Sri Lanka,Khan Shaheb Osman Ali Stadium,lbw b S M S M Senanayake,13.0,46.43,2,42,0.0,0.0,0.0,26,S M S M Senanayake,Fatullah,Bangladesh
2014-11-13,Sri Lanka,Eden Gardens,c D P M D Jayawardene b K M D N Kulasekara,264.0,152.6,0,42,0.0,0.0,0.0,27,K M D N Kulasekara,Kolkata,India
2017-09-21,Australia,Eden Gardens,0,7.0,50.0,0,56,0.0,0.0,0.0,30,0,Kolkata,India
2015-10-18,South Africa,Saurashtra Cricket Association Stadium,0,65.0,87.84,0,49,0.0,0.0,0.0,28,0,"Khandheri, Rajkot",India
2016-10-20,New Zealand,Feroz Shah Kotla,c †L Ronchi b T A Boult,15.0,55.56,1,53,0.0,0.0,0.0,29,T A Boult,Delhi,India
2019-03-13,Australia,Feroz Shah Kotla,st A T Carey b A Zampa,56.0,62.92,0,73,0.0,0.0,0.0,31,A Zampa,Delhi,India
2018-07-14,England,Lord's,b M A Wood,15.0,57.69,1,61,0.0,0.0,0.0,31,M A Wood,London,England
2018-07-17,England,Headingley,c M A Wood b D J Willey,2.0,11.11,0,61,0.0,0.0,0.0,31,D J Willey,Leeds,England
2018-09-18,Hong Kong,Dubai International Cricket Stadium,c Nizakat Khan b Ehsan Khan,23.0,104.55,1,62,0.0,0.0,0.0,31,Ehsan Khan,Dubai,United Arab Emirates
2018-09-19,Pakistan,Dubai International Cricket Stadium,b Shadab Khan,52.0,133.33,0,62,0.0,0.0,0.0,31,Shadab Khan,Dubai,United Arab Emirates
2018-09-21,Bangladesh,Dubai International Cricket Stadium,not out,83.0,79.81,0,62,0.0,0.0,0.0,31,0,Dubai,United Arab Emirates
2018-09-23,Pakistan,Dubai International Cricket Stadium,not out,111.0,93.28,1,63,0.0,0.0,0.0,31,0,Dubai,United Arab Emirates
2018-09-28,Bangladesh,Dubai International Cricket Stadium,c Nazmul Islam b Rubel Hossain,48.0,87.27,0,63,0.0,0.0,0.0,31,Rubel Hossain,Dubai,United Arab Emirates
2018-10-21,West Indies,Barsapara Cricket Stadium,not out,152.0,129.91,0,63,0.0,0.0,0.0,31,0,Guwahati,India
2018-10-29,West Indies,Brabourne Stadium,c C Hemraj b A R Nurse,162.0,118.25,3,69,0.0,0.0,0.0,31,A R Nurse,Mumbai,India
2018-01-11,West Indies,Greenfield International Stadium,not out,63.0,112.5,0,69,0.0,0.0,0.0,31,0,Thiruvananthapuram,India
2019-01-26,New Zealand,Bay Oval,c C de Grandhomme b L H Ferguson,87.0,90.63,0,72,0.0,0.0,0.0,31,L H Ferguson,Mount Maunganui,New Zealand
2019-01-28,New Zealand,Bay Oval,st T W M Latham b M J Santner,62.0,80.52,1,73,0.0,0.0,0.0,31,M J Santner,Mount Maunganui,New Zealand
